"경북|포항|룸즈에이 포항점|낭랑카페|http://roomsa.co.kr/|3|60|TRUE|낭랑 카페는 오랫동안 존재해 왔습니다. 즐거운 방랑 이라는 뜻을 가진 낭랑 카페는 여러분이 아주 깊은 고민을 하며 걷거나 사색에 잠겨 걷거나 그것도 아니라면 정말 아무런 생각없이 멍하니 걸을 때 여러분 앞에 나타납니다. 믿거나 말거나 나폴레옹이나 베토벤도 저희 낭랑 카페를 방문한 적이 있습니다. 그들이 어떤 고민을 안고 낭랑 카페의 문을 열었을지는 아무도 모르는 일입니다. 낭랑카페에는 종업원이 없습니다. 하지만 여러분은 종업원이 없이도 최고의 음료수를 맛볼 수 있죠. 자, 이 수수께끼로 가득한 낭랑카페를 이용해 보시겠어요? 아니면 그냥 지나치시겠습니까?"|
"경북|포항|룸즈에이 포항점|너와 나의 이야기|http://roomsa.co.kr/|4|60|TRUE|너와 처음 만난 건, 달과 가장 가까운 골목길이었다. 박스 안에서 힘겹게 울음소리를 내던 네 모습을 아직 나는 기억한다. 이것은 너와의 처음부터 마지막까지를 다룬, 10년 동안의 이야기이다."|
"경북|포항|룸즈에이 포항점|안개꽃|http://roomsa.co.kr/|4|60|TRUE|화가인 그가 내게서 떠나간지 어느덧 한 달, 나는 여전히 그와의 시간 속에 머물러 있다. 그리움과 원망을 가득 안고 골목길을 걷던 어느 날, 밤공기를 들이마시며 한 걸음씩 내딛던 나는 작은 골목길과는 어울리지 않는 전시관을 보게 되었다. 처음 보는 전시관이었지만 어디선가 그의 향기가 흘러나오는 듯 했고, 그 추억 속의 향기에 이끌려 전시회장 안으로 들어서게 되었다."|
"경남|양산|머더파커 양산점|언타이틀(Untitle)|http://murderparker.com/|4|60|TRUE|아무것도 알 수 없다. 당신만이 이 방의 비밀을 풀어낼 수 있다. 이제 모든 것은.... 당신에게 달려있다."|
"경남|진주|방탈출카페 THE KEY|2017 홍길동|http://www.thekeyescape.com/|3|60|TRUE|사채업자 김악질.<br>그의 금고 안에는 주민들의 피를 빨아 먹어 만든 금괴가 있다.<br>금고를 털어 동네 사람들에게 돌려줘라."|
"경남|진주|방탈출카페 THE KEY|쏘우|http://www.thekeyescape.com/|3|60|TRUE|6번의 용기!<br><br>자... 이제 게임을 시작하지"|
"경남|진주|방탈출카페 THE KEY|동지|http://www.thekeyescape.com/|3|60|TRUE|동지가 남기고간 밀정의 흔적! <br><br>밀정을 찾았다는 소식이 왔다. <br>한 숨에 달려 갔지만 동지는 이미 일본군에 체포 된 후였다. <br>동지가 남기고간 밀정의 흔적. <br>반드시 찾아야만 한다."|
"경남|진주|방탈출카페 THE KEY|7일|http://www.thekeyescape.com/|4|60|TRUE|7일이 되면...!!<br><br>매월 7일이면 진주에서 일어나는 실종사건.<br>그리고 매월 7일이면 어김없이 외출하는 우리집 옆 화실 아저씨.<br>항상 밝게 인사하는 아저씨이지만 나는 그가 수상하다."|
"경남|진주|방탈출카페 THE KEY|올드보이|http://www.thekeyescape.com/|5|60|TRUE|스스로 구원하라 <br><br>노루가 사냥꾼의 손에서 벗어나는 것 같이 새가 그물을 치는 자의 손에서 벗어나는 것 같이 스스로 구원하라."|
"경남|진주|더코드 진주점|위자보드 : 위험한 장난|http://thecode07.kr/|4|60|TRUE|"" 이건 게임일 뿐이야.. 안그래? "" <br>악령을 부르는 게임.. 위자보드.. 어둠 속 악령이 이 집안에 숨어있다."|
"경남|진주|더코드 진주점|재즈바 W : 위험한 거래|http://thecode07.kr/|3|60|TRUE|미국 전지역에 퍼진 마약 [ BLOW ] <br>잠입수사를 통해 불법거래의 단서를 잡아라"|
"경남|진주|더코드 진주점|강력 1반 : 사라진 아이들|http://thecode07.kr/|3|60|TRUE|강력 1반 : 연쇄 유괴사건 <br>유괴사건이 일어난지 1년뒤.. 또 다시 한 아이가 흔적도 없이 사라진다.."|
"경남|진주|더코드 진주점|아파트|http://thecode07.kr/|4|60|TRUE|늦은밤 친구에게서 걸려온 전화.. <br>그녀의 다급한 목소리에선 두려움 같은걸 느낄 수 있었다."|
"경남|진주|더지니어스|박씨네 라면가게|http://xn--9i1bjk550bu3c7vg.com/|5|60|TRUE|50년 전통의 일본 라멘 맛집.<br>맛의 비법을 구하기 위해 영업이 끝난 시간에 가게로 숨어 들어간다.<br>그러나 엄청난 비밀이 숨겨져 있다는 것을 발견하게 되는데..."|
"경남|창원|타임이스케이프|극한탈출|https://timeesc.com/|3.5|60|TRUE|재미있다고 소문난 타임이스케이프에 <br>늦은시간에 체험하러 왔는데, <br>직원들이 우리를 잊고 퇴근을 했다?! <br>나름 방탈출 만렙인 우리들이 <br>방탈출카페에서 무사히 탈출하기!"|
"경남|창원|타임이스케이프|학교<야자탈출>|https://timeesc.com/|3.5|60|TRUE|중요한 약속이 있었지만 <br>야간자율학습때문에 <br>약속을 지키지 못하게 되었다. <br>그런데 마침 담임선생님이 <br>외출을 하였다는 소식을 듣게 되었다. <br>선생님은 1시간후에 돌아 오신다고 한다. <br>선생님이 오시기전에 몰래 학교를 탈출해야 한다...."|
"경남|창원|타임이스케이프|크라임씬|https://timeesc.com/|3.5|60|TRUE|저택에서 벌어진 밀실살인사건! <br>범인은 피해자를 살인하고 <br>어디로 사라진 것일까? 범인은 과연 누구일까? <br><br>흥미진진한 게임중에 서서히 <br>범인의 윤곽이 밝혀지고.... <br>방탈출게임과 추리게임의 절묘한 만남. <br>크리임 씬!"|
"경남|창원|이스케이프탑 창원점|AR 마법사:미로의방|http://changwontop.net/|2|60|TRUE|크리티아 마법학교의 소문난 말썽꾸러기인 학생들(혹은 여러분). 무섭고 괴팍한 기숙사감 선생의 눈을 피해 개교이래로 절대 개방되지 않는 폐건물로 숨어들어간다. 오래된 철문을 열고 들어간 폐건물 안에 한가지 메모 쪽지가 발견되는데 폐건물이 사실은 과거 마법사들을 시험했던 미로이며 '세 가지 보물을 찾아야만 나갈 수 있다'라고 써있다. 들어올 때는 쉽게 들어왔지만, 나갈 때는 마음대로 나갈 수 없는 폐건물. 과연 미로 체험을 무사히 끝낼 수 있을까?"|
"경남|창원|이스케이프탑 창원점|미션:폭탄제거|http://changwontop.net/|3.5|60|TRUE|테러가 빈번하게 일어나는 이곳, A항공사에 폭탄 테러가 일어 났다. 폭탄은 ISA을 기반으로 하여 도시의 전체를 날려버린다고 하는데 <br>폭탄의 주변에는 테러범들이 잠복해 있으며, 레이저를 이용한 경계를 강화해 우리 선발 요원들은 유연성 및 민첩성이 높은 요원들로만 구성되었다. <br>팀원들에게는 60분이라는 시간이 주어졌다. <br>과연 이 미션을 성공 할 수 있을까?"|
"경남|창원|이스케이프탑 창원점|프리즌 수감번호1508|http://changwontop.net/|3.5|60|TRUE|난 수감번호 1508. 여기선 이름없이 이렇게 불린다. <br>억울한 누명을 쓰고 감옥에 갇힌 지 98일. 나뿐만이 아니다. <br>여기 있는 모두가 이곳을 탈출하기 위해서 준비를 하고 있다. <br>이곳에서 나갈 방법은 단 하나! <br>한시간 후에 있을 사형식 전에 나는 간수들을 피해 지금 탈출을 시작하려고 한다."|
"경남|창원|이스케이프탑 창원점|더미러:싸이코패스|http://changwontop.net/|4.5|60|TRUE|'사랑해 여보'' <br>여느 다정한 남편처럼 상냥하고 밝은 모습으로 나에게 사랑한다고 말하는 남편. <br>아무도 모를 것이다. 경찰관인 나의 남편이 누군가를 살해하는 것을 즐기는 미친 싸이코패스인것을... 같이 살던 나 역시도 몰랐으니까. <br>이제 이 사람은 내게 자신의 죄를 뒤집어 씌우고 내가 자살한 것처럼 꾸며 위기를 모면하려 한다. <br>어서 빨리 그의 손아귀에서 벗어나야만 한다. 그래서 세상에 그의 진짜 모습을 알려야 해. <br>구해달라는 비명조차 지를 수 없는 숨막히는 공포감. 나는 과연 살아서 이곳을 벗어날 수 있을까?"|
"경남|양산|머더파커 양산점|머더파커 분노의 살인|http://murderparker.com/|2|60|TRUE|주한미군 아빠와 한국인 엄마 사이에서 태어난 김파커, 그는 생김새가 다르다는 이유로 아이들에게 따돌림을 당하고 숨바꼭질 중 술래가 된 파커만 남겨둔 채 모두들 집으로 돌아가는데... 분노한 파커는 20년 동안 한명한명 찾아가기 시작한다. 그중에 한명인 당신! 파커의 손에서 벗어나야 한다!"|
"경남|양산|머더파커 양산점|엘리스 사라진 아이|http://murderparker.com/|2|60|TRUE|유럽의 어느 평화로운 대저택. 즐거운 식사 도중 엄청난 굉음이 들려온다. 굉음이 들리는 곳은 엘리스의 방. 모두가 황급히 엘리스의 방으로 달려가 보지만 감쪽같이 사라진 엘리스. 그리고 의문의 통로와 수많은 문들... 당신은 탐정이 되어 엘리스의 행적을 찾아내야 한다!"|
"경남|양산|머더파커 양산점|오씨네 장난감 가게|http://murderparker.com/|5|60|TRUE|늦은 밤 10시, 아무도 없는 거리에 불 꺼진 장난감 가게. 왠지 비밀스러워 보이는 그 곳의 주인은 푸근한 미소가 인상적인 오씨 아저씨. 어느 날 당신은 누군가의 부탁을 받은 김파커가 되어 밤이 되면 기묘한 기류가 흐르는 그 곳에 들어가 중요한 무언가를 가지고 나와야 한다!"|
"전남|목포|하일 이스케이프|THE ROOM 014|https://www.instagram.com/HAIL_ESCAPE_ROOM/|3|60|TRUE|어느 집 화장실에서 살인사건 발생. <br>피해자는 45살 J씨 <br>피해자와 함께 있던 D씨는 기절 후 깨어나 <br>살인 사건 현장을 목격하게 된다. <br>방 곳곳을 살펴보니 여기는 예전부터 살인사건이 <br>일어나는 곳 같아 보인다... <br>모든 전화기와 통신 수단이 불통이다. <br>탈출가능한 모든 문이 잠겨있다. <br>분명 어딘가 나갈수 있는 단서가 있을 것이다. <br>그 단서를 찾아 탈출하자."|
"전남|목포|하일 이스케이프|SECRET GARDEN (비밀 화원)|https://www.instagram.com/HAIL_ESCAPE_ROOM/|5|60|TRUE|- 시크릿 가든에만 존재한다는 아주 귀한 꽃을 찾자. <br><br>이 가든은 아주 오래전부터 존재했다. <br>누가 만든 지도 언제 만들어진지도 알 수 없는 시크릿 가든 이지만, 어느 순간 마을에 소문이 퍼지기 시작했다. <br>이 신비한 시크릿 가든에 있는 귀한 꽃을 가지게 되면 소원이 이루어 진다는 소문이 퍼져 많은 사람이 그 꽃을 찾으러 갔지만 누구도 그 귀한 꽃을 찾지 못하였다. <br>그 꽃을 찾아 소원을 이루어 보자."|
"전남|목포|하일 이스케이프|HELICOPTER|https://www.instagram.com/HAIL_ESCAPE_ROOM/|7|60|TRUE|내이름 장덕배, 경찰이다. <br>장기밀매 조직이 활동하는 영역 그 주변을 잠복 근무 하게 되는데 <br>작은 실수로 인해 나의 신분이 노출 되었다. <br>결국 장기밀매 조직에게 잡혀 죽을 위기에 닥치는데.. <br><br>이곳을 탈출하여 지원요청을 하자."|
"전남|목포|하일 이스케이프|외출 :나가서 놀고싶다.|https://www.instagram.com/HAIL_ESCAPE_ROOM/|4|60|TRUE|코로낙 사태로 인해 집 밖으로 <br>외출을 자제한지 꽤 오래.. <br>오랜만에 친구와 산책하기로 했다. <br>안전하게 마스크를 챙겨 나가볼까?"|
"전남|여수|셜록홈즈 여수점|파라오의 심판|http://sherlock-holmes.co.kr/reservation/index.php?sido=13&bno=44&s_sido=13&s_no=44|4|60|TRUE|람세스 3세의 보물을 훔치고 저주를 피해 무사히 탈출한 나 더 많은 파라오 보물의 비밀을 알기 위해 이집트 국립 도서관으로 향하게 되는데... 예기치 않는 모험이 시작 되어 버렸다!"|
"전남|여수|셜록홈즈 여수점|할머니는 마법사|http://sherlock-holmes.co.kr/reservation/index.php?sido=13&bno=44&s_sido=13&s_no=44|3|60|TRUE|어린 시절 할머니는 나에게 줄 곧 마법사에 관한 이야기를 해주었다. 동심 가득한 시절 나에게 그 이야기는 새로운 세상의 로망이었다. 어느날 나에게 할머니가 보낸 편지가 도착했다. 편지의 내용은 나에게 줄 선물이 있으니 보름달이 뜨는 날 밤, 자신의 집으로 찾아오라는 내용 이었다. 일에 치여 신경 쓰지 못했던 할머니께 죄송함을 느끼며 보름달이 뜨는 날 밤 할머니의 집으로 향한다…"|
"전남|여수|셜록홈즈 여수점|빛과 그림자:화이트의죽음2|http://sherlock-holmes.co.kr/reservation/index.php?sido=13&bno=44&s_sido=13&s_no=44|3|60|TRUE|옐로우는 감옥에 가고, 사건은 영원히 종결된 것만 같았다. 이미 30대 때 세계적인 작가가 된 화이트, 그의 옆에는 그림자와 같은 존재인 블랙이 있었다. 그는 일평생을 천재작가의 그늘에서 사는데.. 전세계 독자들을 슬프게 만든 화이트의 죽음, 그 뒤로 언젠가부터 블랙의 소식도 사라지게 되고. 블랙은 금세 사람들의 기억에서 지워져 버렸지만 당신은 왠지 이 사건이 화이트의 죽음과 무관하지 않을 거란 생각이 들어, 화이트의 방을 다시 조사하기 시작한다."|
"전남|여수|셜록홈즈 여수점|이상한 나라의 초대|http://sherlock-holmes.co.kr/reservation/index.php?sido=13&bno=44&s_sido=13&s_no=44|3|60|TRUE|이상한 나라의 파티에 초대되다... 괴이한 토끼를 통해 하얀 여왕의 전보를 받고... 이제 이상한 나라로의 여행이 시작되었다. 하얀 여왕에게 가는 길에 맞이한 붉은 여왕의 카드병정 군대. 당신은 방해를 물리치고 무사히 집으로 돌아갈 수 있을까?"|
"전남|여수|셜록홈즈 여수점|전기톱 살인사건 |http://sherlock-holmes.co.kr/reservation/index.php?sido=13&bno=44&s_sido=13&s_no=44|3|60|TRUE|텍사스주의 어느마을을 지나던 당신은 우연히 이곳 별장까지 찾아오게 된다. 방의 분위기는 심상치 않고 옆방에서는 진한 피냄새가 나는것 같다. 설마 이곳이 소문의 연쇄 살인마가 전기톱으로 사람을 살해하는 장소일까? 마침 살인마는 또다른 희생양을 물색하는데...."|
"전남|여수|셜록홈즈 여수점|크라임씬|http://sherlock-holmes.co.kr/reservation/index.php?sido=13&bno=44&s_sido=13&s_no=44|4|60|TRUE|한 가정에서 일어난 끔찍한 살인사건.. 엄마와 막내딸은 실종이 되었고 다른 가족들은 처참히 살해된 현장만이 남아있다. 이런 끔찍한 일을 벌인사람이 누구인지 이 사건의 수사를 맡게된 나는 과연 범인을 찾아낼 수 있을것인가"|
"전남|여수|셜록홈즈 여수점|무속인 살인사건|http://sherlock-holmes.co.kr/reservation/index.php?sido=13&bno=44&s_sido=13&s_no=44|4|60|TRUE|TV에 출연할 정도로 유명한 무속인 이 어느 날 싸늘한 시체로 발견? 피해자는 TV에 출연하여 화려한 달변과 점술로 유명해진 박수무당으로, 어느 날 자신의 점집에서 잘린 머리가 불에 탄 채 단골 고객에게 발견되었다. 과연 어떠한 연유로 박무당 은 죽음을 맞이해야 했는가? 빛나는 추리로 진실을 파헤쳐 보자."|
"광주|기타|에스케이프|RED|https://www.ascape.online/|5|80|TRUE|미 해겨? 사건을 해결하는 RED 팀 <br><br>생존자는 단 하? 며? <br><br>생존자의 기억 속에서 단서를 찾아야 한다."|
"광주|기타|뉴이스케이프 광주점|한잔해|http://newescape.co.kr/home/|4|60|TRUE|당신은 신입사원 신미생. 소속팀이 회사의 대형 프로젝트를 성공리에 마쳤다.<br><br>""고생 많으셨습니다!""<br>""그래. 다들 수고 많았어요. 오늘은 다 같이 한잔하지!""<br>팀원들과 함께 하는 즐거운 회식!<br>""자~! 다들 한잔해!"" ""마시자고!""<br>그런데.. 이거 어째 너무 많이 마시는것 같은데..?<br>뭔가 심상치 않은 회식자리. 탈없이 무사히 끝날 수 있을까?"|
"광주|기타|뉴이스케이프 광주점|수수꽃다리|http://newescape.co.kr/home/|4|60|TRUE|당신은 미스테리 동호회의 회원. <br>최근 한국 10대 미스테리로 떠오른다는 수수꽃다리 저택의 소문을 듣고 찾아가게 된다. <br>수수꽃다리가 예쁘게 피는 동산 옆의 조용한 저택. 보물이라도 숨겨져 있는 걸까? <br>실제로 가본 사람은 있지만 뭐가 있는지 정확히 말하는 사람은 없는 신기한 곳. <br>그 저택에는 무엇이 있는 걸까? 왜 다녀온 사람들은 아무말도 하지 않는걸까?"|
"광주|기타|더코드|타짜|http://www.thecode-escape.com/|4|60|TRUE|-"|
"광주|기타|방탈출카페 숨바꼭질 2호점|명당|http://www.hideescape.com/layout/res/home.php?go=main|3|80|TRUE|풍수사님 안녕하십니까. <br>저는 광주상인연합회 회장입니다. <br>저희 시장에 문제가 생겼는데, 풍수지리 한 번 봐주시겠습니까?"|
"광주|기타|방탈출카페 숨바꼭질 2호점|재개발구역 : 관계자 외 출입금지|http://www.hideescape.com/layout/res/home.php?go=mainn|3|70|TRUE|용봉철거반 사무실에 뭔가 으스스한 폐건물을 철거해달라는 의뢰가 들어온다. <br>'하... 싫은데... 얼른 폭탄만 설치하고 나오자'"|
"광주|기타|셜록홈즈 광주전대점|이 아이를 기억해주세요|http://sherlock-holmes.co.kr/|4|75|TRUE|영원할 줄로만 알았던 순간들이 예고도 없이 사라지게 되었다. 그렇게 나의 숨바꼭질은 시작되었다."|
"광주|기타|셜록홈즈 광주전대점|나랏말싸미|http://sherlock-holmes.co.kr//|3|75|TRUE|아주 먼 옛날, 하루 벌어 하루 먹고 살기도 바쁜 나무꾼 송 가. 어느 때와 다름없이 평화로운 날을 보내던 송가는 문서를 하나 발견하고... 그런데 이걸 어떻게 읽더라?"|
"광주|기타|머더파커 광주점|파커투|http://murderparker.com/|2|60|TRUE|살인마 파커에게 잡혀 온 두 명의 사람. 당신은 이 곳을 탈출해 파커에게서 벗어나야한다."|
"광주|기타|머더파커 광주점|머더파커 광주점의 비밀|http://murderparker.com/|4|60|TRUE|어서오세요. 머더파커 광주점에 오신 것을 환영합니다."|
"광주|기타|머더파커 광주점|포수 장덕팔|http://murderparker.com/|2|60|TRUE|멧돼지 사냥만 하고 산지 20년이 흘렀다. 과거 군생활을 하며 아내, 딸아이와 함께 행복했던 시절도 있었지만 뒷산에 놀러나갔던 딸아이가 멧돼지의 공격에 세상을 떠난 이후론 더이상 평범한 ‘장덕팔’의 삶은 없었다. 그러던 어느 날 뜻밖의 편지 한통이 도착했다."|
"광주|기타|비밀의 화원 광주점|무고|http://secretgardenescape.com/|4|75|TRUE|무고 : 무당의 저주"|
"광주|기타|비밀의 화원 광주점|비밀의 가족|http://secretgardenescape.com/|5|75|TRUE|어느날부터인가 옆집에서 밤마다 들려오는 쿵쿵대는 소리.참다못한 나는 항의를 하기 위해 옆집으로 찾아간다.이상한 분위기가 감도는 집 안, 이 집에 살고 있는 가족의 비밀을 알게되는데.."|
"광주|기타|비밀의 화원 광주점|라스트 잡|http://secretgardenescape.com/|4|90|TRUE|당신들은 포레전자에 다니고 있는 사원들이다. 그런데 회사가 예고도 없이 몇 주전부터 폐업절차에 들어 가게 되고... 다들 정신이 없는 와중에 한 직원의 와 달라는 연락을 받게 된다. 스펙타클하게 펼쳐지는 그들의 마지막 업무가 시작된다."|
"광주|기타|에스케이프|BETA TESTER|https://www.ascape.online/|4|80|TRUE|취직하기 어려운 요즘 <br><br>알바몽을 통해서 알바를 구하다가 <br><br>나의 눈을 사로 잡는 공고가 눈에 띄었다"|
"광주|기타|에스케이프|LINK|https://www.ascape.online/|3|80|TRUE|-현재 2022년 첫번째 이야기- <br>뉴럴링크라는 회사에서 악의 적인 목적으로 칩을 판매한다는 정보를 얻었다. <br><br>?칩에 대한 정보를 빼내어 막아야 한다! <br><br>요원치고는 조금 부족한 요원 <br><br>?왜일까?"|
"전북|익산|마스터키 익산점|이불밖은위험해|http://www.master-key.co.kr/booking/bk_detail?bid=12|4|60|TRUE|..."|
"전북|익산|마스터키 익산점|경찰서를 털어라|http://www.master-key.co.kr/booking/bk_detail?bid=12|3|60|TRUE|2년전, 이름을 날리던 전문 털이범인 당신은 <br>마침내 최고의 보석을 손에 넣었다. <br><br>하지만 수사망을 피하기 위해 보석을 공사중인 건물에 숨기게 되고 <br><br>눈을 피해 은둔 생활을 하던 2년의 시간, <br>숨겨 놓은 보석을 회수하기위해 같은 장소로 달려갔으나, <br>건축중이던 건물이 시경찰국이 되어있었다!! <br>과연 당신은 그 보석을 다시 손에 넣을 수 있을 것인가! ??"|
"전북|익산|마스터키 익산점|온칼로:10만년의밤|http://www.master-key.co.kr/booking/bk_detail?bid=12|4|60|TRUE|전세계에서 유일한 핵 폐기물 처리시설 ONKALO:온칼로. <br><br>기나긴 프로젝트가 끝나고 완전봉인에 들어가는 순간, <br>옮기지 못한 마지막 핵 폐기물 발견된다. <br><br><br>봉인되기 전 마지막 1시간! <br>폐기물을 안전하게 옮기고 무사히 <br>영구봉인을 마무리 하라!!"|
"전북|익산|마스터키 익산점|트로이 목마|http://www.master-key.co.kr/booking/bk_detail?bid=12|4|60|TRUE|독일군의 작전을 알아내라는 <br><br>상부의 명령에 따르기 위해 <br><br>독일군 장교로 변장해 <br><br>기지내에 잠입에 성공한다. <br><br>당신의 정체가 들키기 전에 <br><br>독일군 비밀정보를 탈취하여 <br><br>당신의 임무를 달성해야 한다"|
"전북|익산|마스터키 익산점|카마수트라|http://www.master-key.co.kr/booking/bk_detail?bid=12|3|60|TRUE|‘진정한 쾌락을 위해서…’ <br><br>자극적인 한문장과 주소 한줄, 본능에 이끌려 도착한 장소. <br>이곳에서 카마수트라의 마지막 비밀을 찾으려 하는데... <br><br>전설속에 전해지는 궁극의 체위! <br>당신은 그 마지막 비밀을 손에 넣을 수 있을 것인가. ??"|
"전북|익산|마스터키 익산점|호스텔|http://www.master-key.co.kr/booking/bk_detail?bid=12|4|60|TRUE|졸업을 축하하며 여행을 떠난 당신과 친구들 <br><br>여행도중 아름다운 마을에 도착하게 되고 <br><br>마을외각의 호텔에서 즐거운 마음으로 잠든다. <br><br>갑작스러운 비명에 놀라 깬 당신 <br><br>달라진 환경에 당혹감을 느끼는데"|
"전북|익산|지니어스 이스케이프 익산 본점|잃어버린 기억|http://www.geniusescape.kr/|4|60|TRUE|어느 날 갑자기 영문도 모른 채 어느 방에 갇혀버린 한 남자. <br>방 안에서 잠이 들고 나면 자신의 기억의 일부가 사라진다는 것을 알고 <br>방을 탈출하기 위해 자신의 잃어버린 기억을 찾기 시작한다."|
"전북|익산|지니어스 이스케이프 익산 본점|도플갱어|http://www.geniusescape.kr/|4|60|TRUE|세상에 혼자 버려진 채 홀로 외롭게 살던 나에게 쌍둥이 동생과 가족이 존재한 다는 것을 어느 날 우연히 알게 된 언니, 자신의 존재를 잊은 채 살아가고 있는 가족과 동생에게 분노하며 치밀하게 복수를 계획하게 된다..!"|
"전북|익산|지니어스 이스케이프 익산 본점|수상한 회사원|http://www.geniusescape.kr/|5|60|TRUE|해가 저무는 금요일 저녁, 임사원은 만원 버스에 몸을 맡긴 채 어딘가로 향하고 있다.<br><br>무려 2개월 만인가? 계속 되는 야근 속 정시퇴근에 들뜬표정<br><br>여자친구의 생일인 오늘, 퇴근이 늦을까 하는 걱정에 그녀의 잔소리와 함께 바쁘게 시작되었지만 결국 그의 두 손에는 케이크와 선물이 들려있다.<br><br>하지만 약속장소에 거의 도착할 즈음 걸려온전화 한 통, 급히 버스에서 내린 후 택시를타고 회사로 향한다.<br><br>휴가 중인 최부장이 또 자신 대신 수상한 일 처리를 맡긴 것이다.<br><br>방법은 하나 뿐이다.<br><br>내키진 않지만 최부장이 시킨 일을 끝낸 후, 다시 그녀를 향해 가는 것 뿐!"|
"전북|익산|지니어스 이스케이프 익산 본점|제물|http://www.geniusescape.kr/|4|60|TRUE|미국 북부지역에는 중심으로 베인교라 불리는 집단이 있었다. <br>이들은 처음에는 수십 명 정도의 소규모 집단이었으나 교주 베인의 엄청난 카리스마로 불과 1년여 만에 전세계로 빠르게 퍼져나갔고, 현재는 그 수가 10만이 넘었을 것으로 예상하고 있다. <br>처음에는 단지 베인에 대한 충성심으로만 똘똘 뭉치던 회원들은 점차 늘어가는 회원들에게 경쟁의식을 느끼기 시작했고 급기야 일부 지역에서는 사람을 잡아다 제물의식에 동원하기까지 이르렀다. <br>급기야 미국 및 관련 국가들이 베인교를 해체시키기 위해 다양한 방법을 강구해 보았으나, 회원 대부분이 사회에서 정상적 활동을 하고 있었기에 이들의 정체를 파악하기란 무척이나 어려운 일 이었고, 지금 이 순간에도 베인교로 인한 제물은 생겨나고 있다."|
